{
  "schema_version": "1.0",
  "generated_by": "ERP Frontend Lead",
  "title": "ERP System Frontend Specifications",
  "description": "Comprehensive frontend architecture specifications for the Enterprise Resource Planning system covering all 8 modules with Vue.js 3 + Element Plus implementation",
  
  "architecture": {
    "framework": "Vue.js 3 (Composition API)",
    "ui_library": "Element Plus",
    "state_management": "Pinia with typed stores",
    "routing": "Vue Router 4",
    "http_client": "Axios with interceptors",
    "build_tool": "Vite",
    "styling": "SCSS with Element Plus theming",
    "patterns": ["MVVM", "Composables", "Component composition"],
    "design_system": {
      "colors": {
        "primary": "#409EFF",
        "success": "#67C23A", 
        "warning": "#E6A23C",
        "danger": "#F56C6C",
        "info": "#909399"
      },
      "spacing": "8px grid system",
      "typography": "Element Plus default with Chinese support",
      "breakpoints": {
        "mobile": "768px",
        "tablet": "992px", 
        "desktop": "1200px",
        "large": "1920px"
      }
    }
  },

  "state_management": {
    "stores": {
      "auth": {
        "purpose": "User authentication and role management",
        "state": {
          "user": "User | null",
          "token": "string | null", 
          "roles": "string[]",
          "permissions": "string[]",
          "isAuthenticated": "boolean"
        },
        "actions": [
          "login(credentials): Promise<void>",
          "logout(): void",
          "refreshToken(): Promise<void>",
          "checkPermission(permission: string): boolean",
          "hasRole(role: string): boolean"
        ],
        "getters": [
          "currentUser: User | null",
          "userRoles: string[]",
          "isAdmin: boolean"
        ]
      },
      "requisition": {
        "purpose": "Requisition management and workflow",
        "state": {
          "requisitions": "Requisition[]",
          "currentRequisition": "Requisition | null",
          "draftItems": "RequisitionItem[]",
          "loading": "boolean",
          "pagination": "PaginationState",
          "filters": "RequisitionFilters"
        },
        "actions": [
          "fetchRequisitions(filters?: RequisitionFilters): Promise<void>",
          "createRequisition(data: CreateRequisitionData): Promise<Requisition>",
          "updateRequisition(id: string, data: UpdateRequisitionData): Promise<void>",
          "submitRequisition(id: string): Promise<void>",
          "approveItem(reqId: string, itemId: string, data: ApprovalData): Promise<void>",
          "rejectItem(reqId: string, itemId: string, reason: string): Promise<void>",
          "questionItem(reqId: string, itemId: string, reason: string): Promise<void>"
        ]
      },
      "procurement": {
        "purpose": "Purchase order management and supplier operations",
        "state": {
          "purchaseOrders": "PurchaseOrder[]",
          "buildCandidates": "RequisitionItem[]",
          "suppliers": "Supplier[]",
          "currentPO": "PurchaseOrder | null",
          "selectedItems": "string[]",
          "previewData": "POPreviewData | null"
        },
        "actions": [
          "fetchBuildCandidates(supplierId?: string): Promise<void>",
          "createPO(data: CreatePOData): Promise<PurchaseOrder>",
          "updatePO(poNo: string, data: UpdatePOData): Promise<void>",
          "confirmPurchase(poNo: string, idempotencyKey: string): Promise<void>",
          "withdrawPO(poNo: string, reason: string): Promise<void>",
          "reorganizePO(poNo: string, reason: string): Promise<void>"
        ]
      },
      "leadtime": {
        "purpose": "Delivery tracking and milestone management",
        "state": {
          "trackingItems": "TrackingItem[]",
          "consolidations": "Consolidation[]",
          "milestones": "Milestone[]",
          "visibleOnly": "boolean"
        },
        "actions": [
          "fetchVisibleTracking(): Promise<void>",
          "updateMilestone(poNo: string, data: MilestoneData): Promise<void>",
          "createConsolidation(data: ConsolidationData): Promise<void>",
          "addPOToConsolidation(consolidationId: string, poNo: string): Promise<void>",
          "bulkUpdateMilestones(consolidationId: string, data: MilestoneData): Promise<void>"
        ]
      },
      "receiving": {
        "purpose": "Goods receiving and confirmation",
        "state": {
          "receivingList": "ReceivingItem[]",
          "currentPO": "PurchaseOrder | null",
          "region": "domestic | international",
          "suppliers": "Supplier[]"
        },
        "actions": [
          "fetchReceivingList(filters: ReceivingFilters): Promise<void>",
          "fetchPOForReceiving(poNo: string): Promise<void>",
          "confirmItemReceived(poNo: string, itemId: string): Promise<void>"
        ]
      },
      "inventory": {
        "purpose": "Inventory management and storage operations", 
        "state": {
          "inventoryItems": "InventoryItem[]",
          "storageTree": "StorageNode[]",
          "searchFilters": "InventoryFilters",
          "putawayList": "PutawayItem[]",
          "acceptanceList": "AcceptanceItem[]"
        },
        "actions": [
          "searchInventory(filters: InventoryFilters): Promise<void>",
          "fetchStorageTree(): Promise<void>",
          "assignStorage(data: StorageAssignmentData): Promise<void>",
          "issueInventory(data: IssueData): Promise<void>",
          "confirmAcceptance(itemRef: string): Promise<void>",
          "quickStorageIn(data: QuickInData): Promise<void>"
        ]
      },
      "accounting": {
        "purpose": "Billing and payment management",
        "state": {
          "billingCandidates": "BillingCandidate[]",
          "billingHistory": "BillingRecord[]",
          "currentMonth": "string",
          "selectedSupplier": "string | null",
          "paymentTerms": "PaymentTerm[]"
        },
        "actions": [
          "fetchBillingCandidates(supplierId: string, month: string): Promise<void>",
          "generateBilling(data: BillingData): Promise<void>",
          "markPaidBatch(billingId: string, data: PaymentData): Promise<void>",
          "markPaidSingle(poNo: string, data: PaymentData): Promise<void>",
          "fetchBillingHistory(filters: BillingFilters): Promise<void>"
        ]
      }
    }
  },

  "modules": {
    "requisition": {
      "name": "請購管理",
      "description": "Requisition creation, approval, and management workflow",
      "routes": [
        {
          "path": "/requisitions",
          "name": "RequisitionList", 
          "component": "RequisitionList",
          "roles": ["Everyone"],
          "meta": { "title": "請購單列表" }
        },
        {
          "path": "/requisitions/new",
          "name": "CreateRequisition",
          "component": "CreateRequisition", 
          "roles": ["Everyone"],
          "meta": { "title": "建立請購單" }
        },
        {
          "path": "/requisitions/:id",
          "name": "RequisitionDetail",
          "component": "RequisitionDetail",
          "roles": ["Everyone"],
          "meta": { "title": "請購單詳情" }
        },
        {
          "path": "/requisitions/:id/review",
          "name": "RequisitionReview", 
          "component": "RequisitionReview",
          "roles": ["Procurement", "ProcurementMgr"],
          "meta": { "title": "請購單審核" }
        }
      ],
      "components": {
        "RequisitionList": {
          "type": "page",
          "purpose": "Display list of requisitions with filtering and pagination",
          "template_structure": [
            "PageHeader with title and create button",
            "FilterBar with status, date range, and search",
            "DataTable with columns: req_no, requester, status, created_at, actions",
            "Pagination component"
          ],
          "props": {},
          "emits": ["create-requisition", "view-detail", "edit-draft"],
          "composables": ["useRequisitionStore", "usePagination", "usePermissions"],
          "ui_elements": [
            "el-card",
            "el-table", 
            "el-pagination",
            "el-button",
            "el-input",
            "el-select",
            "el-date-picker"
          ]
        },
        "CreateRequisition": {
          "type": "page",
          "purpose": "Form for creating new requisitions with item management",
          "template_structure": [
            "PageHeader with save draft and submit buttons",
            "RequisitionHeader form (purpose, usage type)",
            "RequisitionItemsTable with add/remove functionality",
            "ActionButtons (save draft, submit for review)"
          ],
          "props": {},
          "emits": ["save-draft", "submit-review"],
          "composables": ["useRequisitionStore", "useFormValidation"],
          "ui_elements": [
            "el-form",
            "el-form-item", 
            "el-input",
            "el-select",
            "el-table",
            "el-button",
            "el-input-number"
          ]
        },
        "RequisitionItemsTable": {
          "type": "component",
          "purpose": "Editable table for managing requisition items",
          "template_structure": [
            "Table header with Add Item button",
            "Editable rows with item_name, quantity, spec, remarks",
            "Action column with remove button"
          ],
          "props": {
            "items": "RequisitionItem[]",
            "readonly": "boolean"
          },
          "emits": ["add-item", "remove-item", "update-item"],
          "validation_rules": {
            "item_name": "required|string|max:200",
            "quantity": "required|integer|min:1",
            "spec": "string|max:500",
            "remarks": "string|max:1000"
          }
        },
        "RequisitionReview": {
          "type": "page",